,,,,,,,,,,,,,,,,,,,,,,,,,,,
,UE41,Intitulé de l'EC,AU3,Automatique 3,,,,,,,,,,,,,,,,,,,,,,,
,,Crédits,3,,,,,,,,,,,,,,,,,,,,,,,,
,,Nbe h.,49,,,,,,,,,,,,,,,,,,,,,,,,
,,,,,,,,,,,,,,,,,,,,,,,,,,,
,,,,,,,,,,,,,,,,,,,,,,,,,,,
,,,,,,,,,,,,,Niveau de la compétence,Compétence ciblée C ou mobilisée M,,,,,,,,,,,,,
COMPETENCES SPECIFIQUES A LA SPECIALITE,,,,,,,,,,,,,,,,,,,,,,,,,,,
,,,,,,,,,,,,,,,,,,,,,,,,,,,
Compétence 1,,"Spécifier, modéliser et concevoir les méthodes et algorithmes pour le traitement et la gestion de l'information véhiculée par les signaux et les images",,,,,,,,,,,3,C,,,,,,,,,,,,,
,Sous compétence,"Spécifier, modéliser et concevoir les méthodes et algorithmes pour le traitement et la gestion de des flux de production",,,,,,,,,,,,,,,,,,,,,,,,,
,Capacité,Appréhender la lecture et l'écriture d'un cahier des charges,,,,,,,,,,,,,,,,,,,,,,,,,
,Capacité,Modéliser un système de production en vue de son analyse de performances et /ou son dimensionnement,,,,,,,,,,,,,,,,,,,,,,,,,
,Capacité,"Analyser les propriétés du modèle liées au marquage initial : vivacité, bornage et réinitialisation",,,,,,,,,,,,,,,,,,,,,,,,,
,Capacité,Analyser les performances d'un système et le dimensionner ,,,,,,,,,,,,,,,,,,,,,,,,,
,Capacité,Transférer ses connaissances à d'autres types de systèmes qui ne concernent pas la production ,,,,,,,,,,,,,,,,,,,,,,,,,
,Connaissance,Connaître l'outil Réseau de Petri,,,,,,,,,,,,,,,,,,,,,,,,,
,Connaissance,Méthodologie pour modéliser un système de Production via les réseaux de Petri,,,,,,,,,,,,,,,,,,,,,,,,,
,Connaissance,Méthodologie pour analyser les perfromances et/ou le dimensionnement d'un système de production,,,,,,,,,,,,,,,,,,,,,,,,,
,Mots-clés,"Réseau de Petri, modélisation, analyse de perfromances et dimensionnement",,,,,,,,,,,,,,,,,,,,,,,,,
,,,,,,,,,,,,,,,,,,,,,,,,,,,
Compétence 2,,Mettre en oeuvre les étapes permettant le contrôle du fonctionnement d’un système discret ou continu,,,,,,,,,,,3,C,,,,,,,,,,,,,
,Sous compétence,Développer la communication dans un système automatisé,,,,,,,,,,,,,,,,,,,,,,,,,
,Capacité,Implémenter la commande d'équipements industriels communicant en Modbus/TCP,,,,,,,,,,,,,,,,,,,,,,,,,
,Capacité,Conception d'Interface Homme Machine accessible via le Web,,,,,,,,,,,,,,,,,,,,,,,,,
,Sous compétence,Développer la commande d’un système discret,,,,,,,,,,,,,,,,,,,,,,,,,
,Capacité,Modéliser la facette commande d'un système du point de vue fonctionnel,,,,,,,,,,,,,,,,,,,,,,,,,
,Capacité,Encapsuler le savoir-faire dans un composant logiciel,,,,,,,,,,,,,,,,,,,,,,,,,
,Capacité,Capitaliser les savoir-faire et les rendre réutilisables,,,,,,,,,,,,,,,,,,,,,,,,,
,Capacité,Mise en œuvre dans un atelier logiciel industriel de programmation d'API,,,,,,,,,,,,,,,,,,,,,,,,,
,Connaissance,Initiation aux réseaux de terrain industriels,,,,,,,,,,,,,,,,,,,,,,,,,
,Connaissance,Sensibilisation à la cyber-sécurité,,,,,,,,,,,,,,,,,,,,,,,,,
,Connaissance,Appréhender les concepts de l'ingénierie système,,,,,,,,,,,,,,,,,,,,,,,,,
,Connaissance,Appréhender le cycle de vie d'un système,,,,,,,,,,,,,,,,,,,,,,,,,
,Connaissance,Modélisation SysML,,,,,,,,,,,,,,,,,,,,,,,,,
,,,,,,,,,,,,,,,,,,,,,,,,,,,
,,,,,,,,,,,,,,,,,,,,,,,,,,,
,,,,,,,,,,,,,,,,,,,,,,,,,,,
Compétence 3,,Concevoir et développer des logiciels haut et bas niveau pour des systèmes (traitement et gestion de l’information),,,,,,,,,,,2,C,,,,,,,,,,,,,
,Capacité,Simuler un système de production et le modéliser par un réseau de Petri,,,,,,,,,,,,,,,,,,,,,,,,,
,Capacité,"Analyser, via un logiciel de simulation, les propriétés structurelles d'un système de production complexe",,,,,,,,,,,,,,,,,,,,,,,,,
,Capacité,"Analyser, via un logiciel de simulation, les propriétés liées au marquage initial d'un système de production complexe",,,,,,,,,,,,,,,,,,,,,,,,,
,Connaissance,Mise en œuvre du savoir-faire en Réseau de Petri sur un logiciel de simulation,,,,,,,,,,,,,,,,,,,,,,,,,
,Connaissance,Analyser les résultats issus de la simulation et les critiquer,,,,,,,,,,,,,,,,,,,,,,,,,
,Mots-clés,"Logiciel de simulation utilisant les réseau de Petri, Modélisation, Analyse ",,,,,,,,,,,,,,,,,,,,,,,,,
,,,,,,,,,,,,,,,,,,,,,,,,,,,
,,,,,,,,,,,,,,,,,,,,,,,,,,,
Compétence 4,,Mettre en œuvre des principes et stratégies d’ordonnancements des tâches et de gestion,,,,,,,,,,,2,C,,,,,,,,,,,,,
,Capacité,Spécifier des contraintes d'ordonnancement dans un cahier des charges,,,,,,,,,,,,,,,,,,,,,,,,,
,Capacité,Modéliser des contraintes d'ordonnancement via les réseaux de Petri,,,,,,,,,,,,,,,,,,,,,,,,,
,Capacité,Calculer les invariants issus de l'ordonnancement,,,,,,,,,,,,,,,,,,,,,,,,,
,Capacité,Comprendre l'influence de l'ordonnancement sur les propriétés structurelles d'un réseau de Petri,,,,,,,,,,,,,,,,,,,,,,,,,
,Connaissance,Notion de base d'ordonnancement dans un système de production,,,,,,,,,,,,,,,,,,,,,,,,,
,Connaissance,Connaître l'influence de l'ordonnancement sur les propriétés du système de production,,,,,,,,,,,,,,,,,,,,,,,,,
,Mots-clés,Ordonancement et Réseau de Petri,,,,,,,,,,,,,,,,,,,,,,,,,
,,,,,,,,,,,,,,,,,,,,,,,,,,,
,,,,,,,,,,,,,,,,,,,,,,,,,,,
COMPETENCES EN SCIENCES POUR L'INGENIEUR,,,,,,,,,,,,,,,,,,,,,,,,,,,
,,,,,,,,,,,,,,,,,,,,,,,,,,,
Compétence 1,,Analyser un système (ou un problème) réel ou virtuel ,,,,,,,,,,2,M,,,,,,,,,,,,,,
,,,,,,,,,,,,,,,,,,,,,,,,,,,
Compétence 2,,Exploiter un modèle d'un système réel ou virtuel,,,,,,,,,,2,M,,,,,,,,,,,,,,
,,,,,,,,,,,,,,,,,,,,,,,,,,,
Compétence 3,,Mettre en oeuvre une démarche expérimentale,,,,,,,,,,2,M,,,,,,,,,,,,,,
,,,,,,,,,,,,,,,,,,,,,,,,,,,
Compétence 4,,Concevoir un système répondant à un cahier des charges,,,,,,,,,,2,M,,,,,,,,,,,,,,
,,,,,,,,,,,,,,,,,,,,,,,,,,,
Compétence 5,,Traiter des données ,,,,,,,,,,,M,,,,,,,,,,,,,,
,,,,,,,,,,,,,,,,,,,,,,,,,,,
Compétence 6,,Communiquer une analyse ou une démarche scientifique,,,,,,,,,,2,M,,,,,,,,,,,,,,
,,,,,,,,,,,,,,,,,,,,,,,,,,,
,,,,,,,,,,,,,,,,,,,,,,,,,,,
"COMPÉTENCES EN HUMANITÉS, DOCUMENTATION ET EDUCATION PHYSIQUE ET SPORTIVE ",,,,,,,,,,,,,,,,,,,,,,,,,,,
,,,,,,,,,,,,,,,,,,,,,,,,,,,
,,,,,,,,,,,,,,,,,,,,,,,,,,,
Compétence 5,,Agir de manière responsable dans un monde complexe ,,,,,,,,,,,M,,,,,,,,,,,,,,
,,,,,,,,,,,,,,,,,,,,,,,,,,,
Compétence 6,,"Se situer, travailler, évoluer dans une entreprise, une organisation socio-productive ",,,,,,,,,,,M,,,,,,,,,,,,,,
