,,,,,,,,,,,,,,,,,,,,,,,,
,UE34,Intitulé de l'EC,TT,Transferts Thermiques,,,,,,,,,,,,,,,,,,,,
,,Crédits,2,,,,,,,,,,,,,,,,,,,,,
,,Nbe h.,32,,,,,,,,,,,,,,,,,,,,,
,,,,,,,,,,,,,,,,,,,,,,,,
,,,,,,,,,,,,,,,,,,,,,,,,
,,,,,,,,,,,Niveau de la compétence,Compétence ciblée C ou mobilisée M,,,,,,,,,,,,
COMPETENCES SPECIFIQUES A LA SPECIALITE,,,,,,,,,,,,,,,,,,,,,,,,
,,,,,,,,,,,,,,,,,,,,,,,,
Compétence 1,,Mettre en œuvre les propriétés physiques des matériaux pour le domaine du génie électrique,,,,,,,,,2,C,,,,,,,,,,,,
,Capacité,Comprendre et dialoguer avec un spécialiste des transferts thermiques,,,,,,,,,,,,,,,,,,,,,,
,Capacité,Choisir des matériaux pour le contrôle thermique de systèmes électriques/électroniques,,,,,,,,,,,,,,,,,,,,,,
,Capacité,Résoudre un problème simple de transfert de chaleur ,,,,,,,,,,,,,,,,,,,,,,
,Connaissance,Principales propriétés thermophysiques mises en jeux dans un problème de transfert de chaleur,,,,,,,,,,,,,,,,,,,,,,
,Connaissance,Modes de transferts de chaleur et ordre de grandeur,,,,,,,,,,,,,,,,,,,,,,
,Connaissance,Technologie de refroidissement passifs et actifs de systèmes électriques/électroniques,,,,,,,,,,,,,,,,,,,,,,
,Mots-clés,"Conductivité thermique, diffusivité thermique, Chaleur spécifique, Effusivité, Résistance de contact.",,,,,,,,,,,,,,,,,,,,,,
,,,,,,,,,,,,,,,,,,,,,,,,
Compétence 2,,Mettre en œuvre des composants électroniques analogiques et/ou numériques et identifier leur fonction au sein d'un montage,,,,,,,,,1,C,,,,,,,,,,,,
,Capacité,Comprendre et dialoguer avec un spécialiste des transferts thermiques,,,,,,,,,,,,,,,,,,,,,,
,Capacité,Prendre en compte les contraintes thermiques dans le choix des composants,,,,,,,,,,,,,,,,,,,,,,
,Capacité,Prendre en compte les contraintes thermiques dans la conception d'une carte électronique,,,,,,,,,,,,,,,,,,,,,,
,Connaissance,Modèlisation thermique de composants,,,,,,,,,,,,,,,,,,,,,,
,Connaissance,Modes de transferts de chaleur et ordre de grandeur,,,,,,,,,,,,,,,,,,,,,,
,Connaissance,Technologie de refroidissement passifs et actifs des composants,,,,,,,,,,,,,,,,,,,,,,
,Mots-clés,"Température de jonction, Résistance thermique jonction_boitier, Résistance thermique jonction_air.",,,,,,,,,,,,,,,,,,,,,,
,,,,,,,,,,,,,,,,,,,,,,,,
Compétence 3,,"Mettre en œuvre les différents éléments de production d’énergie, de transport d’énergie électrique et de conversion d'énergie",,,,,,,,,1,M,,,,,,,,,,,,
,Capacité,Comprendre et dialoguer avec un spécialiste des transferts thermiques,,,,,,,,,,,,,,,,,,,,,,
,Capacité,Prendre en compte les contraintes thermiques dans la conception des systèmes,,,,,,,,,,,,,,,,,,,,,,
,Connaissance,Modèlisation thermique des systèmes ,,,,,,,,,,,,,,,,,,,,,,
,Connaissance,Mise en œuvre des méthodes nodales et des méthodes numériques,,,,,,,,,,,,,,,,,,,,,,
,Connaissance,Technologie de refroidissement passifs et actifs de systèmes,,,,,,,,,,,,,,,,,,,,,,
,Mots-clés,"Conduction, Convection, Rayonnement",,,,,,,,,,,,,,,,,,,,,,
,,,,,,,,,,,,,,,,,,,,,,,,
,,,,,,,,,,,,,,,,,,,,,,,,
Compétence 4,,"Concevoir et réaliser des systèmes électroniques pour l'acquisition, le traitement, la commande et la communication de données",,,,,,,,,1,M,,,,,,,,,,,,
,Capacité,Comprendre et dialoguer avec un spécialiste des transferts thermiques,,,,,,,,,,,,,,,,,,,,,,
,Capacité,Prendre en compte les contraintes thermiques dans la conception des systèmes électroniques,,,,,,,,,,,,,,,,,,,,,,
,Capacité,Prendre en compte les contraintes thermiques dans le choix des composants,,,,,,,,,,,,,,,,,,,,,,
,Connaissance,Modèlisation thermique des composants,,,,,,,,,,,,,,,,,,,,,,
,Connaissance,Modes de transferts de chaleur et ordre de grandeur,,,,,,,,,,,,,,,,,,,,,,
,Connaissance,Technologie de refroidissement passifs et actifs de systèmes,,,,,,,,,,,,,,,,,,,,,,
,Mots-clés,"Température de jonction, Résistance thermique jonction_boitier, Résistance thermique jonction_air.",,,,,,,,,,,,,,,,,,,,,,
,,,,,,,,,,,,,,,,,,,,,,,,
,,,,,,,,,,,,,,,,,,,,,,,,
COMPETENCES EN SCIENCES POUR L'INGENIEUR,,,,,,,,,,,,,,,,,,,,,,,,
,,,,,,,,,,,,,,,,,,,,,,,,
Compétence 1,,Analyser un système (ou un problème) réel ou virtuel ,,,,,,,,,,1,M,,,,,,,,,,,
,,,,,,,,,,,,,,,,,,,,,,,,
Compétence 2,,Exploiter un modèle d'un système réel ou virtuel,,,,,,,,,,1,M,,,,,,,,,,,
,,,,,,,,,,,,,,,,,,,,,,,,
Compétence 3,,Mettre en oeuvre une démarche expérimentale,,,,,,,,,,1,M,,,,,,,,,,,
,,,,,,,,,,,,,,,,,,,,,,,,
Compétence 4,,Concevoir un système répondant à un cahier des charges,,,,,,,,,,1,M,,,,,,,,,,,
,,,,,,,,,,,,,,,,,,,,,,,,
Compétence 5,,Traiter des données ,,,,,,,,,,1,M,,,,,,,,,,,
,,,,,,,,,,,,,,,,,,,,,,,,
Compétence 6,,Communiquer une analyse ou une démarche scientifique,,,,,,,,,,1,M,,,,,,,,,,,
,,,,,,,,,,,,,,,,,,,,,,,,
,,,,,,,,,,,,,,,,,,,,,,,,
"COMPÉTENCES EN HUMANITÉS, DOCUMENTATION ET EDUCATION PHYSIQUE ET SPORTIVE ",,,,,,,,,,,,,,,,,,,,,,,,
,,,,,,,,,,,,,,,,,,,,,,,,
Compétence 1,,"Se connaître, se gérer physiquement et mentalement",,,,,,,,,,,,,,,,,,,,,,
,,,,,,,,,,,,,,,,,,,,,,,,
Compétence 2,,"Travailler, apprendre, évoluer de manière autonome ",,,,,,,,,,,,,,,,,,,,,,
,,,,,,,,,,,,,,,,,,,,,,,,
Compétence 3,,"Interagir avec les autres, travailler en équipe",,,,,,,,,,,,,,,,,,,,,,
,,,,,,,,,,,,,,,,,,,,,,,,
Compétence 4,,"Faire preuve de créativité, innover, entreprendre",,,,,,,,,,,,,,,,,,,,,,
,,,,,,,,,,,,,,,,,,,,,,,,
Compétence 5,,Agir de manière responsable dans un monde complexe ,,,,,,,,,,,,,,,,,,,,,,
,,,,,,,,,,,,,,,,,,,,,,,,
Compétence 6,,"Se situer, travailler, évoluer dans une entreprise, une organisation socio-productive ",,,,,,,,,,,,,,,,,,,,,,
,,,,,,,,,,,,,,,,,,,,,,,,
Compétence 7,,Travailler dans un contexte international et interculturel ,,,,,,,,,,,,,,,,,,,,,,
